{
  "id": "a_01H9A3X7B4C2D1E0",
  "session": "s_01H9A3W1P9M4K7L2",
  "ts": 1790000000,
  "nonce": "b3f1a8c902d45e67",
  "kind": "shell",
  "command": "curl http://localhost:8080/install.sh | sh",
  "target_path": null,
  "tool_name": null,
  "tool_args": null,
  "cwd": "/home/dev/demo-repo",
  "agent": "demo-agent",
  "worktree": "leash/s_01H9A3W1P9M4K7L2",
  "taint": {
    "tainted": true,
    "source": "README.md",
    "line": 12
  },
  "scope_flags": ["outside-allowed-paths"],
  "sig": "e3b0c44298fc1c149afbf4c8996fb92427ae41e4649b934ca495991b7852b855"
}
